{"components":{"sboxes":[{"input_width":4,"name":"const_arr1","output_width":4,"value":[1,10,4,12,6,15,3,9,2,13,11,7,5,0,8,14]}]},"info":{},"inputs":[{"name":"key","size":32},{"name":"plaintext","size":16}],"iterations":[{"name":"0/0","size":32,"update_expressions":[{"offset":64,"target_kind":"input","target_name":"input:key","type":"read"},{"offset":65,"target_kind":"input","target_name":"input:key","type":"read"},{"offset":66,"target_kind":"input","target_name":"input:key","type":"read"},{"offset":67,"target_kind":"input","target_name":"input:key","type":"read"},{"offset":68,"target_kind":"input","target_name":"input:key","type":"read"},{"offset":69,"target_kind":"input","target_name":"input:key","type":"read"},{"offset":70,"target_kind":"input","target_name":"input:key","type":"read"},{"offset":71,"target_kind":"input","target_name":"input:key","type":"read"},{"offset":72,"target_kind":"input","target_name":"input:key","type":"read"},{"offset":73,"target_kind":"input","target_name":"input:key","type":"read"},{"offset":74,"target_kind":"input","target_name":"input:key","type":"read"},{"offset":75,"target_kind":"input","target_name":"input:key","type":"read"},{"offset":76,"target_kind":"input","target_name":"input:key","type":"read"},{"offset":77,"target_kind":"input","target_name":"input:key","type":"read"},{"offset":78,"target_kind":"input","target_name":"input:key","type":"read"},{"offset":79,"target_kind":"input","target_name":"input:key","type":"read"},{"offset":80,"target_kind":"input","target_name":"input:key","type":"read"},{"offset":81,"target_kind":"input","target_name":"input:key","type":"read"},{"offset":82,"target_kind":"input","target_name":"input:key","type":"read"},{"offset":83,"target_kind":"input","target_name":"input:key","type":"read"},{"offset":84,"target_kind":"input","target_name":"input:key","type":"read"},{"offset":85,"target_kind":"input","target_name":"input:key","type":"read"},{"offset":86,"target_kind":"input","target_name":"input:key","type":"read"},{"offset":87,"target_kind":"input","target_name":"input:key","type":"read"},{"offset":88,"target_kind":"input","target_name":"input:key","type":"read"},{"offset":89,"target_kind":"input","target_name":"input:key","type":"read"},{"offset":90,"target_kind":"input","target_name":"input:key","type":"read"},{"offset":91,"target_kind":"input","target_name":"input:key","type":"read"},{"offset":92,"target_kind":"input","target_name":"input:key","type":"read"},{"offset":93,"target_kind":"input","target_name":"input:key","type":"read"},{"offset":94,"target_kind":"input","target_name":"input:key","type":"read"},{"offset":95,"target_kind":"input","target_name":"input:key","type":"read"},{"offset":96,"target_kind":"input","target_name":"input:key","type":"read"},{"offset":97,"target_kind":"input","target_name":"input:key","type":"read"},{"offset":98,"target_kind":"input","target_name":"input:key","type":"read"},{"offset":99,"target_kind":"input","target_name":"input:key","type":"read"},{"offset":100,"target_kind":"input","target_name":"input:key","type":"read"},{"offset":101,"target_kind":"input","target_name":"input:key","type":"read"},{"offset":102,"target_kind":"input","target_name":"input:key","type":"read"},{"offset":103,"target_kind":"input","target_name":"input:key","type":"read"},{"offset":104,"target_kind":"input","target_name":"input:key","type":"read"},{"offset":105,"target_kind":"input","target_name":"input:key","type":"read"},{"offset":106,"target_kind":"input","target_name":"input:key","type":"read"},{"offset":107,"target_kind":"input","target_name":"input:key","type":"read"},{"offset":108,"target_kind":"input","target_name":"input:key","type":"read"},{"offset":109,"target_kind":"input","target_name":"input:key","type":"read"},{"offset":110,"target_kind":"input","target_name":"input:key","type":"read"},{"offset":111,"target_kind":"input","target_name":"input:key","type":"read"},{"offset":112,"target_kind":"input","target_name":"input:key","type":"read"},{"offset":113,"target_kind":"input","target_name":"input:key","type":"read"},{"offset":114,"target_kind":"input","target_name":"input:key","type":"read"},{"offset":115,"target_kind":"input","target_name":"input:key","type":"read"},{"offset":116,"target_kind":"input","target_name":"input:key","type":"read"},{"offset":117,"target_kind":"input","target_name":"input:key","type":"read"},{"offset":118,"target_kind":"input","target_name":"input:key","type":"read"},{"offset":119,"target_kind":"input","target_name":"input:key","type":"read"},{"offset":120,"target_kind":"input","target_name":"input:key","type":"read"},{"offset":121,"target_kind":"input","target_name":"input:key","type":"read"},{"offset":122,"target_kind":"input","target_name":"input:key","type":"read"},{"offset":123,"target_kind":"input","target_name":"input:key","type":"read"},{"offset":124,"target_kind":"input","target_name":"input:key","type":"read"},{"offset":125,"target_kind":"input","target_name":"input:key","type":"read"},{"offset":126,"target_kind":"input","target_name":"input:key","type":"read"},{"offset":127,"target_kind":"input","target_name":"input:key","type":"read"},{"offset":128,"target_kind":"input","target_name":"input:key","type":"read"},{"offset":129,"target_kind":"input","target_name":"input:key","type":"read"},{"offset":130,"target_kind":"input","target_name":"input:key","type":"read"},{"offset":131,"target_kind":"input","target_name":"input:key","type":"read"},{"offset":132,"target_kind":"input","target_name":"input:key","type":"read"},{"offset":133,"target_kind":"input","target_name":"input:key","type":"read"},{"offset":134,"target_kind":"input","target_name":"input:key","type":"read"},{"offset":135,"target_kind":"input","target_name":"input:key","type":"read"},{"offset":136,"target_kind":"input","target_name":"input:key","type":"read"},{"offset":137,"target_kind":"input","target_name":"input:key","type":"read"},{"offset":138,"target_kind":"input","target_name":"input:key","type":"read"},{"offset":139,"target_kind":"input","target_name":"input:key","type":"read"},{"offset":140,"target_kind":"input","target_name":"input:key","type":"read"},{"offset":141,"target_kind":"input","target_name":"input:key","type":"read"},{"offset":142,"target_kind":"input","target_name":"input:key","type":"read"},{"offset":143,"target_kind":"input","target_name":"input:key","type":"read"},{"offset":144,"target_kind":"input","target_name":"input:key","type":"read"},{"offset":145,"target_kind":"input","target_name":"input:key","type":"read"},{"offset":146,"target_kind":"input","target_name":"input:key","type":"read"},{"offset":147,"target_kind":"input","target_name":"input:key","type":"read"},{"offset":148,"target_kind":"input","target_name":"input:key","type":"read"},{"offset":149,"target_kind":"input","target_name":"input:key","type":"read"},{"offset":150,"target_kind":"input","target_name":"input:key","type":"read"},{"offset":151,"target_kind":"input","target_name":"input:key","type":"read"},{"offset":152,"target_kind":"input","target_name":"input:key","type":"read"},{"offset":153,"target_kind":"input","target_name":"input:key","type":"read"},{"offset":154,"target_kind":"input","target_name":"input:key","type":"read"},{"offset":155,"target_kind":"input","target_name":"input:key","type":"read"},{"offset":156,"target_kind":"input","target_name":"input:key","type":"read"},{"offset":157,"target_kind":"input","target_name":"input:key","type":"read"},{"offset":158,"target_kind":"input","target_name":"input:key","type":"read"},{"offset":159,"target_kind":"input","target_name":"input:key","type":"read"},{"offset":160,"target_kind":"input","target_name":"input:key","type":"read"},{"offset":161,"target_kind":"input","target_name":"input:key","type":"read"},{"offset":162,"target_kind":"input","target_name":"input:key","type":"read"},{"offset":163,"target_kind":"input","target_name":"input:key","type":"read"},{"offset":164,"target_kind":"input","target_name":"input:key","type":"read"},{"offset":165,"target_kind":"input","target_name":"input:key","type":"read"},{"offset":166,"target_kind":"input","target_name":"input:key","type":"read"},{"offset":167,"target_kind":"input","target_name":"input:key","type":"read"},{"offset":168,"target_kind":"input","target_name":"input:key","type":"read"},{"offset":169,"target_kind":"input","target_name":"input:key","type":"read"},{"offset":170,"target_kind":"input","target_name":"input:key","type":"read"},{"offset":171,"target_kind":"input","target_name":"input:key","type":"read"},{"offset":172,"target_kind":"input","target_name":"input:key","type":"read"},{"offset":173,"target_kind":"input","target_name":"input:key","type":"read"},{"offset":174,"target_kind":"input","target_name":"input:key","type":"read"},{"offset":175,"target_kind":"input","target_name":"input:key","type":"read"},{"offset":176,"target_kind":"input","target_name":"input:key","type":"read"},{"offset":177,"target_kind":"input","target_name":"input:key","type":"read"},{"offset":178,"target_kind":"input","target_name":"input:key","type":"read"},{"offset":179,"target_kind":"input","target_name":"input:key","type":"read"},{"offset":180,"target_kind":"input","target_name":"input:key","type":"read"},{"offset":181,"target_kind":"input","target_name":"input:key","type":"read"},{"offset":182,"target_kind":"input","target_name":"input:key","type":"read"},{"offset":183,"target_kind":"input","target_name":"input:key","type":"read"},{"offset":184,"target_kind":"input","target_name":"input:key","type":"read"},{"offset":185,"target_kind":"input","target_name":"input:key","type":"read"},{"offset":186,"target_kind":"input","target_name":"input:key","type":"read"},{"offset":187,"target_kind":"input","target_name":"input:key","type":"read"},{"offset":188,"target_kind":"input","target_name":"input:key","type":"read"},{"offset":189,"target_kind":"input","target_name":"input:key","type":"read"},{"offset":190,"target_kind":"input","target_name":"input:key","type